{
  "artifact_name": "controller-benchmark-compiler-coverage-trust-receipt-v0",
  "generated_on": "2026-04-03T22:43:27.792787+00:00",
  "script_path": "repo:/programs/partial-reprogramming-controller/scripts/controller_phase_stratified_compile_condition_records.py",
  "inputs": {
    "study_corpus": "repo:/programs/partial-reprogramming-controller/benchmarks/phase-stratified-controller-benchmark-v0/controller-benchmark-study-corpus-v0.csv",
    "negative_families": "repo:/programs/partial-reprogramming-controller/benchmarks/phase-stratified-controller-benchmark-v0/controller-benchmark-negative-family-registry-v0.json",
    "conditions": "repo:/programs/partial-reprogramming-controller/benchmarks/phase-stratified-controller-benchmark-v0/controller-benchmark-condition-fixture-v0.jsonl",
    "compiler_rules_dir": "repo:/programs/partial-reprogramming-controller/benchmarks/phase-stratified-controller-benchmark-v0/compiler-rules"
  },
  "outputs": {
    "condition_records": "repo:/programs/partial-reprogramming-controller/benchmarks/phase-stratified-controller-benchmark-v0/controller-benchmark-condition-records-v0.jsonl",
    "coverage_trust_receipt": "repo:/programs/partial-reprogramming-controller/benchmarks/phase-stratified-controller-benchmark-v0/controller-benchmark-compiler-coverage-trust-receipt-v0.json"
  },
  "condition_count": 8,
  "source_kind_counts": {
    "study_specific_rule": 3,
    "study_specific_rule_with_matrix_field_overrides": 5
  },
  "rule_backed_condition_count": 8,
  "fixture_backed_condition_count": 0,
  "rule_backed_condition_ids": [
    "VITA_CTRL_001",
    "VITA_CTRL_002",
    "VITA_CTRL_003",
    "VITA_CTRL_004",
    "VITA_CTRL_008",
    "VITA_CTRL_005",
    "VITA_CTRL_006",
    "VITA_CTRL_007"
  ],
  "fixture_backed_condition_ids": [],
  "common_bounded_manual_judgment_fields": [
    "active_negative_family_ids",
    "condition_summary",
    "evidence_modes_present",
    "phase_layer",
    "risk_pressure_level"
  ],
  "common_derived_fields": [
    "primary_evidence_class",
    "supporting_evidence_classes",
    "age_signal_status",
    "identity_status",
    "risk_status",
    "negative_family_roles",
    "negative_family_tiers",
    "source_trace",
    "provenance"
  ],
  "common_matrix_extracted_fields": [
    "age_signal_score",
    "identity_pressure_level"
  ],
  "common_matrix_support_fields": [
    "age_signal_score",
    "risk_pressure_level"
  ],
  "trust_boundary_claim": "All benchmark condition records now preserve explicit source trace. Study-specific rules mean the benchmark no longer depends on the global fixture for migrated families. Gill now carries bounded matrix-derived age and identity overrides plus bounded matrix support for risk pressure, Roux now carries a bounded matrix-derived identity override plus explicit matrix support for age, and the remaining benchmark decision fields stay explicit as machine-readable human judgments rather than being silently flattened into raw automation.",
  "coverage_verdict": "all_live_conditions_rule_backed",
  "condition_rows": [
    {
      "condition_id": "VITA_CTRL_001",
      "study_family_id": "sarkar_2020",
      "source_kind": "study_specific_rule",
      "trust_status": "rule_backed_with_bounded_manual_judgment",
      "traceable_support": {
        "study_family_id": "sarkar_2020",
        "accession_bundle": "GSE142439;PRJNA598923",
        "derived_from": [
          "repo:/programs/partial-reprogramming-controller/benchmarks/phase-stratified-controller-benchmark-v0/compiler-rules/sarkar_2020-v0.json",
          "repo:/programs/partial-reprogramming-controller/benchmarks/phase-stratified-controller-benchmark-v0/controller-benchmark-study-corpus-v0.csv",
          "repo:/programs/partial-reprogramming-controller/benchmarks/phase-stratified-controller-benchmark-v0/controller-benchmark-negative-family-registry-v0.json"
        ]
      },
      "bounded_manual_judgment_fields": [
        "phase_layer",
        "evidence_modes_present",
        "age_signal_score",
        "identity_pressure_level",
        "risk_pressure_level",
        "active_negative_family_ids",
        "condition_summary"
      ],
      "derived_fields": [
        "primary_evidence_class",
        "supporting_evidence_classes",
        "age_signal_status",
        "identity_status",
        "risk_status",
        "negative_family_roles",
        "negative_family_tiers",
        "source_trace",
        "provenance"
      ],
      "matrix_extracted_fields": [],
      "matrix_support_fields": [],
      "compiler_trust_notes": [
        "This condition is now carried by a dedicated study-specific rule pack rather than the global fixture.",
        "The benchmark decision fields remain bounded human judgments encoded in the rule pack rather than direct matrix-derived extraction outputs."
      ],
      "condition_summary": "Sarkar initiation-only bulk condition used as early age-movement context without heterogeneity resolution."
    },
    {
      "condition_id": "VITA_CTRL_002",
      "study_family_id": "roux_2022_sc",
      "source_kind": "study_specific_rule_with_matrix_field_overrides",
      "trust_status": "rule_backed_with_matrix_field_derivation",
      "traceable_support": {
        "study_family_id": "roux_2022_sc",
        "accession_bundle": "GSE176206",
        "derived_from": [
          "repo:/programs/partial-reprogramming-controller/benchmarks/phase-stratified-controller-benchmark-v0/compiler-rules/roux_2022_sc-v0.json",
          "repo:/programs/partial-reprogramming-controller/benchmarks/phase-stratified-controller-benchmark-v0/matrix-extraction/roux_2022_sc-matrix-derived-field-layer-v0.json",
          "repo:/programs/partial-reprogramming-controller/benchmarks/phase-stratified-controller-benchmark-v0/matrix-extraction/roux_2022_sc-matrix-derived-extraction-intermediate-v0.json",
          "https://www.ncbi.nlm.nih.gov/geo/download/?acc=GSE176206&format=file&file=GSE176206_msc_sokm.h5ad.gz",
          "repo:/programs/partial-reprogramming-controller/benchmarks/phase-stratified-controller-benchmark-v0/controller-benchmark-study-corpus-v0.csv",
          "repo:/programs/partial-reprogramming-controller/benchmarks/phase-stratified-controller-benchmark-v0/controller-benchmark-negative-family-registry-v0.json"
        ]
      },
      "bounded_manual_judgment_fields": [
        "phase_layer",
        "evidence_modes_present",
        "age_signal_score",
        "risk_pressure_level",
        "active_negative_family_ids",
        "condition_summary"
      ],
      "derived_fields": [
        "primary_evidence_class",
        "supporting_evidence_classes",
        "age_signal_status",
        "identity_status",
        "risk_status",
        "negative_family_roles",
        "negative_family_tiers",
        "source_trace",
        "provenance"
      ],
      "matrix_extracted_fields": [
        "identity_pressure_level"
      ],
      "matrix_support_fields": [
        "age_signal_score"
      ],
      "compiler_trust_notes": [
        "Roux now carries an accession-backed matrix-derived identity-pressure override from the single-cell MSC initiation snapshot.",
        "Roux age still remains a manual benchmark field in this tranche, but it now carries explicit matrix support from aged-versus-young control anchors in the same accession-backed file.",
        "The Roux file exposes only one lane per age_treatment group, so this tranche treats age movement as support-only rather than a direct override.",
        "Roux remains initiation-phase and pseudotime-supported rather than duration-authoritative, so this tranche does not claim late safety or duration calibration.",
        "Risk pressure remains manual because the initiation snapshot gives strong identity-escape evidence but not a clean outcome-grade hazard proxy."
      ],
      "condition_summary": "Roux day-6 single-cell initiation snapshot with youthful movement entangled with identity suppression."
    },
    {
      "condition_id": "VITA_CTRL_003",
      "study_family_id": "gill_2022",
      "source_kind": "study_specific_rule_with_matrix_field_overrides",
      "trust_status": "rule_backed_with_matrix_field_derivation",
      "traceable_support": {
        "study_family_id": "gill_2022",
        "accession_bundle": "GSE165180",
        "derived_from": [
          "repo:/programs/partial-reprogramming-controller/benchmarks/phase-stratified-controller-benchmark-v0/compiler-rules/gill_2022-v0.json",
          "repo:/programs/partial-reprogramming-controller/benchmarks/phase-stratified-controller-benchmark-v0/matrix-extraction/gill_2022-matrix-derived-field-layer-v0.json",
          "repo:/programs/partial-reprogramming-controller/benchmarks/phase-stratified-controller-benchmark-v0/matrix-extraction/gill_2022-matrix-derived-extraction-intermediate-v0.json",
          "https://www.ncbi.nlm.nih.gov/geo/download/?acc=GSE165176&format=file&file=GSE165176_Log2_RPM_Sendai_reprogramming.txt.gz",
          "https://www.ncbi.nlm.nih.gov/geo/download/?acc=GSE165177&format=file&file=GSE165177_Log2_RPM_Transient_reprogramming.txt.gz",
          "repo:/programs/partial-reprogramming-controller/benchmarks/phase-stratified-controller-benchmark-v0/controller-benchmark-study-corpus-v0.csv",
          "repo:/programs/partial-reprogramming-controller/benchmarks/phase-stratified-controller-benchmark-v0/controller-benchmark-negative-family-registry-v0.json"
        ]
      },
      "bounded_manual_judgment_fields": [
        "phase_layer",
        "evidence_modes_present",
        "risk_pressure_level",
        "active_negative_family_ids",
        "condition_summary"
      ],
      "derived_fields": [
        "primary_evidence_class",
        "supporting_evidence_classes",
        "age_signal_status",
        "identity_status",
        "risk_status",
        "negative_family_roles",
        "negative_family_tiers",
        "source_trace",
        "provenance"
      ],